[{"id":"r5-gatekeeping","slug":"gatekeeping-theory","record_level":"complete","type":"theory_model","subtype":"theory","name_zh":"把关理论","name_original":"Gatekeeping theory","aliases":[{"name":"守门理论","kind":"alternate_translation","note":null},{"name":"守门人理论","kind":"alternate_translation","note":"该译名突出行动者，使用时仍需说明组织、网络、算法和平台机制。"}],"summary":"把关理论研究信息如何经过特定渠道和选择机制而被采用、拒绝、排序或获得可见性。Lewin 的渠道与“门”构想目前只是有待正文核读的一般社会过程前史线索；White 的新闻电讯稿选择个案以及网络和数字研究中的被把关者、算法与平台则按各自已登记的证据范围呈现。","why_it_matters":"学生看到的新闻与平台信息不是世界的完整镜像。把关理论训练学生具体识别渠道、选择者或机制、选择标准和可见性结果，并区分经典新闻个案与数字环境中的多行动者结构。","key_points":[{"id":"r5-gatekeeping-k1","statement":"Lewin 在一般社会过程研究中以食物渠道说明渠道、门和守门人的构想；把它视为后来新闻把关研究的概念前史，是本站依据材料范围作出的限定，而不是声称该文已经提出成熟的新闻理论。","evidence_status":"interpretive","evidence":[{"source_id":"G22","locator":"印刷页 145—146 的已核原文片段","support_note":"片段直接支持食物渠道、门和守门人的一般概念；“新闻把关研究的概念前史”是本站据后续研究史所作的范围限定。","support_role":"qualifies"}]},{"id":"r5-gatekeeping-k2","statement":"White 收集一家非都市报纸一位电讯编辑七天内采用和拒绝的电讯稿，并分析其取舍理由。","evidence_status":"direct","evidence":[{"source_id":"G18","locator":"pp. 383–390，研究对象、材料与拒稿理由分析","support_note":"全文直接支持七天、一位编辑的个案设计及采用与拒绝材料的分析。","support_role":"supports"}]},{"id":"r5-gatekeeping-k3","statement":"网络把关框架要求同时识别把关者、把关机制和被把关者，并把被把关者相对于把关者的位置纳入分析。","evidence_status":"direct","evidence":[{"source_id":"S013","locator":"Abstract","support_note":"摘要提出 network gatekeeping identification theory，并把把关关系中的相关行动者和机制纳入框架。","support_role":"supports"}]},{"id":"r5-gatekeeping-k4","statement":"数字新闻把关模型把个人、算法和平台列为当代新闻传播中的重要选择者或机制。","evidence_status":"direct","evidence":[{"source_id":"Q342","locator":"author postprint PDF pp. 6–15, A Typology of Digital Gatekeepers; Platforms and Their Gatekeeping Mechanisms; Conclusion","support_note":"正文将记者、个人业余者、策略专业者和算法列为四类把关者，并把平台作为发布空间与规则设置者，区分集中式和分散式把关机制；本句据此保留‘选择者或机制’的区分。","support_role":"supports"}]}],"limits_or_debates":[{"id":"r5-gatekeeping-l1","statement":"White 的研究只观察一位编辑和七天材料，不能据此断言所有新闻生产都由个人偏好决定。","evidence_status":"direct","evidence":[{"source_id":"G18","locator":"pp. 383–390，研究对象与材料范围","support_note":"个案边界直接限定可外推的组织、时期与机制。","support_role":"qualifies"}]},{"id":"r5-gatekeeping-l2","statement":"个体、网络、用户、算法和平台是可分别询问的分析维度；现有材料不足以证成一条完整的新闻把关多层次发展史。","evidence_status":"interpretive","evidence":[{"source_id":"S013","locator":"Abstract","support_note":"网络框架扩展了行动者和关系范围，但不能单独证明整个领域的历史演进。","support_role":"qualifies"},{"source_id":"Q342","locator":"author postprint PDF pp. 14–15, Conclusion","support_note":"结论综合四类把关者、平台与机制，并明确模型仍需进一步实证检验；它不单独证明完整历史发展序列。","support_role":"qualifies"}]},{"id":"r5-gatekeeping-l3","statement":"在排序、推荐和协作式可见性共存的环境中，二元的进入／拒绝隐喻可能不足，但这并不表示经典把关问题已经失效。","evidence_status":"interpretive","evidence":[{"source_id":"Q342","locator":"author postprint PDF pp. 10–15, platform mechanisms and Conclusion","support_note":"正文说明集中式与分散式机制、多把关者和多平台互动，并在结论称把关概念对数字选择仍有用且模型仍需检验，支持此边界判断。","support_role":"qualifies"}]},{"id":"r5-gatekeeping-l4","statement":"内容被删除、推荐或降权的事实不能单独证明决定正当或不正当，规范评价还需要法律、伦理和权利依据。","evidence_status":"interpretive","evidence":[{"source_id":"Q342","locator":"author postprint PDF pp. 10–15, platform rules, power and Conclusion","support_note":"正文支持把平台规则、可见性机制与权力作为描述性分析对象；它没有提供删除、推荐或降权正当性的法律或伦理判准，规范区分仍是编辑边界。","support_role":"qualifies"}]}],"area_memberships":[{"area_id":"institutions","is_primary":true,"rationale":"新闻与平台中的选择规则、角色和组织权力是核心问题。"},{"area_id":"communication","is_primary":false,"rationale":"把关解释信息如何进入传播渠道及后续流通。"},{"area_id":"media_society","is_primary":false,"rationale":"选择机制塑造公共可见的媒介现实。"},{"area_id":"effects","is_primary":false,"rationale":"选择与排序改变受众可接触的信息集合，但不单独证明效果。"}],"learning_resources":[{"title":"The Gate Keeper: A Case Study in the Selection of News","source_id":"G18","purpose":"先用一个范围明确的新闻个案理解材料如何被采用或拒绝。","level":"introductory","locator":"pp. 383–390"},{"title":"Frontiers in Group Dynamics II: Channels of Group Life; Social Planning and Action Research","source_id":"G22","purpose":"回读渠道、门和守门人的一般社会过程前史；正文目前待复核。","level":"intermediate","locator":"预定核读印刷页 145–146"},{"title":"Modelling Contemporary Gatekeeping: The Rise of Individuals, Algorithms and Platforms in Digital News Dissemination","source_id":"Q342","purpose":"比较个人、算法和平台在数字新闻传播中的把关位置。","level":"intermediate","locator":"author postprint full text, PDF pp. 6–15"}],"learning_links":[{"target_id":"r5-journalism","reason":"先把把关问题放回新闻生产与新闻研究的制度语境。","sequence_hint":"before"},{"target_id":"r4-agenda-setting","reason":"比较“信息如何进入传播流”与“议题显著性如何对应”的不同问题。","sequence_hint":"compare"},{"target_id":"r7-platform-governance","reason":"继续考察平台、算法和用户如何共同塑造可见性与问责。","sequence_hint":"after"}],"temporal_profile":"relatively_stable","as_of":null,"last_evidence_check":"2026-09-11","next_review_due":null,"controversy_status":"contested","controversy_note":"争议集中于把关的分析层次、选择权分布，以及经典进入／拒绝隐喻能否充分解释排序、推荐和协作式可见性。","positions":[{"id":"r5-gatekeeping-p1","statement":"经典新闻个案以编辑对电讯稿的采用和拒绝为主要观察对象。","evidence_status":"direct","evidence":[{"source_id":"G18","locator":"pp. 383–390","support_note":"White 的个案直接呈现编辑层面的选择。","support_role":"supports"}]},{"id":"r5-gatekeeping-p2","statement":"网络与数字取向把关系结构、个人、算法和平台纳入把关分析。","evidence_status":"direct","evidence":[{"source_id":"S013","locator":"Abstract","support_note":"网络把关框架扩展关系与行动者维度。","support_role":"supports"},{"source_id":"Q342","locator":"author postprint PDF pp. 6–15, typology, platform mechanisms and Conclusion","support_note":"正文把个人与算法纳入把关者类型，并把平台及其集中式／分散式机制纳入同一数字把关模型。","support_role":"supports"}]}],"questions_explained":["哪些信息可以通过特定渠道中的门，哪些被挡在外面？","选择权由个人、组织、用户、算法或平台中的哪些行动者和机制掌握？","选择标准和权力关系如何影响新闻与公共信息的可见性？"],"propositions":[{"id":"r5-gatekeeping-prop1","statement":"把关分析需要明确渠道、选择机制、被选择的信息和可观察的结果。","evidence_status":"interpretive","evidence":[{"source_id":"G18","locator":"pp. 383–390","support_note":"White 个案将材料、编辑决定与采用／拒绝结果对应起来；命题是对可操作要素的归纳。","support_role":"supports"}]},{"id":"r5-gatekeeping-prop2","statement":"在数字新闻环境中，把关不能只归因于单个编辑，还需考察算法、平台和用户行为。","evidence_status":"direct","evidence":[{"source_id":"Q342","locator":"author postprint PDF pp. 1–2 and 10–15","support_note":"引言、平台机制章节与结论均明确说明数字新闻选择涉及用户、算法、平台规则及其互动，不能只用单个编辑解释。","support_role":"supports"}]}],"conditions":["使用把关隐喻时须具体指出渠道、门或机制、把关者或被把关者以及选择结果。","White 的七日单编辑个案不能代表所有新闻组织或时代。","“新闻把关”是该理论在新闻领域的特定用法，不作为整个理论的同义名。"],"review_status":"ready_for_review","created_at":"2026-09-11","updated_at":"2026-09-15","reviewed_at":null}]
